{
  "schemaVersion": "1.0.0",
  "agentId": "agent-codex-01",
  "displayName": "Codex Engineer",
  "agentType": "ENGINEER",
  "healthStatus": "HEALTHY",
  "statusSummary": "Ready for instruction",
  "selectedForSession": true,
  "assignedToGoal": true,
  "sessionRole": "Code Implementation",
  "goalRole": "Primary Implementer",
  "canContinueWithoutAgent": false,
  "userActionRequired": false,
  "recommendedActions": [],
  "stateRevision": 1,
  "updatedAt": "2026-09-18T00:00:04.000Z"
}

